{
  "requirement_hash": "a3c0ffee1234",
  "iteration": 0,
  "generator_session_id": "gen-a5-v0-session",
  "generator_model": "gpt-5.6-sol",
  "unit_tests": [
    {
      "id": "UT-A3-PERCENTAGE",
      "title": "정률 쿠폰의 할인액과 최종 금액을 계산한다",
      "requirement_ids": [
        "REQ-A3-DISCOUNT",
        "REQ-A3-MOCK"
      ],
      "system_under_test": "calculateCouponDiscount",
      "arrange": [
        "상품 금액 10000원",
        "할인율 20%이고 최대 할인 한도가 없는 쿠폰"
      ],
      "act": "실제 calculateCouponDiscount를 호출한다.",
      "assertions": [
        {
          "actual": "할인 금액",
          "matcher": "toBe",
          "expected": 2000
        },
        {
          "actual": "최종 금액",
          "matcher": "toBe",
          "expected": 8000
        }
      ],
      "mocks": []
    },
    {
      "id": "UT-A3-FIXED-PRICE-CAP",
      "title": "정액 할인액을 상품 금액으로 제한한다",
      "requirement_ids": [
        "REQ-A3-DISCOUNT"
      ],
      "system_under_test": "calculateCouponDiscount",
      "arrange": [
        "상품 금액 10000원",
        "정액 할인 15000원 쿠폰"
      ],
      "act": "실제 calculateCouponDiscount를 호출한다.",
      "assertions": [
        {
          "actual": "할인 금액",
          "matcher": "toBe",
          "expected": 10000
        },
        {
          "actual": "최종 금액",
          "matcher": "toBe",
          "expected": 0
        }
      ],
      "mocks": []
    },
    {
      "id": "UT-A3-MAXIMUM-CAPS",
      "title": "정률 할인액을 숫자 최대 할인 한도로 제한한다",
      "requirement_ids": [
        "REQ-A3-CAP"
      ],
      "system_under_test": "calculateCouponDiscount",
      "arrange": [
        "소계 10000원",
        "할인율 50%",
        "maximum_discount 2000원"
      ],
      "act": "실제 calculateCouponDiscount를 호출한다.",
      "assertions": [
        {
          "actual": "할인 금액",
          "matcher": "toBe",
          "expected": 2000
        }
      ],
      "mocks": []
    },
    {
      "id": "UT-A3-ZERO-CAP",
      "title": "maximum_discount 0을 유효한 한도로 적용한다",
      "requirement_ids": [
        "REQ-A3-CAP"
      ],
      "system_under_test": "calculateCouponDiscount",
      "arrange": [
        "소계 10000원",
        "할인율 50%",
        "maximum_discount 0원"
      ],
      "act": "실제 calculateCouponDiscount를 호출한다.",
      "assertions": [
        {
          "actual": "할인 금액",
          "matcher": "toBe",
          "expected": 0
        }
      ],
      "mocks": []
    },
    {
      "id": "UT-A3-EMPTY-CODE",
      "title": "빈 쿠폰 코드를 DB 조회 없이 400으로 거절한다",
      "requirement_ids": [
        "REQ-A3-INPUT"
      ],
      "system_under_test": "validateCouponCode",
      "arrange": [
        "공백뿐인 쿠폰 코드",
        "로그인 사용자",
        "호출 기록이 가능한 Supabase fake"
      ],
      "act": "validateCouponCode를 호출한다.",
      "assertions": [
        {
          "actual": "결과",
          "matcher": "toEqual",
          "expected": {
            "error": "쿠폰 코드를 입력해주세요.",
            "status": 400
          }
        },
        {
          "actual": "supabase.from 호출 횟수",
          "matcher": "toBe",
          "expected": 0
        }
      ],
      "mocks": [
        {
          "target": "SupabaseClient",
          "reason": "DB 외부 I/O 호출 여부를 관찰하기 위해 fake로 대체"
        }
      ]
    },
    {
      "id": "UT-A3-UNAUTHENTICATED",
      "title": "로그인하지 않은 사용자를 DB 조회 없이 401로 거절한다",
      "requirement_ids": [
        "REQ-A3-INPUT"
      ],
      "system_under_test": "validateCouponCode",
      "arrange": [
        "유효한 형식의 쿠폰 코드",
        "빈 userId",
        "호출 기록이 가능한 Supabase fake"
      ],
      "act": "validateCouponCode를 호출한다.",
      "assertions": [
        {
          "actual": "결과",
          "matcher": "toEqual",
          "expected": {
            "error": "로그인이 필요합니다.",
            "status": 401
          }
        },
        {
          "actual": "supabase.from 호출 횟수",
          "matcher": "toBe",
          "expected": 0
        }
      ],
      "mocks": [
        {
          "target": "SupabaseClient",
          "reason": "DB 외부 I/O 호출 여부를 관찰하기 위해 fake로 대체"
        }
      ]
    },
    {
      "id": "UT-A3-NOT-FOUND",
      "title": "존재하지 않는 쿠폰을 404로 거절한다",
      "requirement_ids": [
        "REQ-A3-LOOKUP"
      ],
      "system_under_test": "validateCouponCode",
      "arrange": [
        "쿠폰 조회가 null을 반환하는 Supabase fake",
        "로그인 사용자와 10000원 소계"
      ],
      "act": "validateCouponCode를 호출한다.",
      "assertions": [
        {
          "actual": "결과",
          "matcher": "toEqual",
          "expected": {
            "error": "유효하지 않은 쿠폰 코드입니다.",
            "status": 404
          }
        }
      ],
      "mocks": [
        {
          "target": "SupabaseClient",
          "reason": "쿠폰 DB 조회를 결정적으로 재현"
        }
      ]
    },
    {
      "id": "UT-A3-EXPIRED",
      "title": "종료일이 지난 쿠폰을 400으로 거절한다",
      "requirement_ids": [
        "REQ-A3-LOOKUP"
      ],
      "system_under_test": "validateCouponCode",
      "arrange": [
        "현재 시각을 2026-08-17 12:00 KST로 고정",
        "valid_until이 2026-08-16인 쿠폰"
      ],
      "act": "validateCouponCode를 호출한다.",
      "assertions": [
        {
          "actual": "결과",
          "matcher": "toEqual",
          "expected": {
            "error": "만료된 쿠폰입니다.",
            "status": 400
          }
        }
      ],
      "mocks": [
        {
          "target": "SupabaseClient",
          "reason": "쿠폰 DB 조회를 결정적으로 재현"
        },
        {
          "target": "system clock",
          "reason": "만료 판정을 고정"
        }
      ]
    },
    {
      "id": "UT-A3-MINIMUM-EQUAL",
      "title": "주문 금액이 최소 주문금액과 같으면 적용한다",
      "requirement_ids": [
        "REQ-A3-MINIMUM"
      ],
      "system_under_test": "validateCouponCode",
      "arrange": [
        "최소 주문금액 10000원인 정액 1000원 쿠폰",
        "주문 소계 10000원",
        "사용 횟수 0회"
      ],
      "act": "validateCouponCode를 호출한다.",
      "assertions": [
        {
          "actual": "할인 금액",
          "matcher": "toBe",
          "expected": 1000
        },
        {
          "actual": "최종 금액",
          "matcher": "toBe",
          "expected": 9000
        }
      ],
      "mocks": [
        {
          "target": "SupabaseClient",
          "reason": "쿠폰 및 사용 내역 DB 조회를 결정적으로 재현"
        }
      ]
    },
    {
      "id": "UT-A3-MINIMUM-MINUS-ONE",
      "title": "주문 금액이 최소 주문금액보다 1원 부족하면 거절한다",
      "requirement_ids": [
        "REQ-A3-MINIMUM"
      ],
      "system_under_test": "validateCouponCode",
      "arrange": [
        "최소 주문금액 10000원인 쿠폰",
        "주문 소계 9999원"
      ],
      "act": "validateCouponCode를 호출한다.",
      "assertions": [
        {
          "actual": "결과",
          "matcher": "toEqual",
          "expected": {
            "error": "최소 주문 금액 10,000원 이상이어야 합니다.",
            "status": 400
          }
        }
      ],
      "mocks": [
        {
          "target": "SupabaseClient",
          "reason": "쿠폰 DB 조회를 결정적으로 재현"
        }
      ]
    },
    {
      "id": "UT-A3-USER-USAGE-LIMIT",
      "title": "사용자 사용 횟수가 한도에 도달하면 거절한다",
      "requirement_ids": [
        "REQ-A3-USAGE"
      ],
      "system_under_test": "validateCouponCode",
      "arrange": [
        "user_usage_limit 1인 쿠폰",
        "해당 사용자의 사용 횟수 1회"
      ],
      "act": "validateCouponCode를 호출한다.",
      "assertions": [
        {
          "actual": "결과",
          "matcher": "toEqual",
          "expected": {
            "error": "이미 사용 한도를 채운 쿠폰입니다.",
            "status": 400
          }
        }
      ],
      "mocks": [
        {
          "target": "SupabaseClient",
          "reason": "쿠폰 및 사용자 사용 횟수 DB 조회를 결정적으로 재현"
        }
      ]
    },
    {
      "id": "UT-A3-ORDER-REAL-DOMAIN",
      "title": "주문 서비스가 실제 할인 계산 결과로 결제와 저장을 요청한다",
      "requirement_ids": [
        "REQ-A3-DISCOUNT",
        "REQ-A3-MOCK"
      ],
      "system_under_test": "createCouponOrder",
      "arrange": [
        "10000원 상품과 20% 정률 쿠폰",
        "쿠폰 저장소·결제사·주문 저장소 fake",
        "현재 시각 고정"
      ],
      "act": "createCouponOrder를 호출한다.",
      "assertions": [
        {
          "actual": "결제 요청 금액",
          "matcher": "toBe",
          "expected": 8000
        },
        {
          "actual": "저장 주문 할인 금액",
          "matcher": "toBe",
          "expected": 2000
        },
        {
          "actual": "저장 주문 상태",
          "matcher": "toBe",
          "expected": "PAID"
        }
      ],
      "mocks": [
        {
          "target": "CouponRepository",
          "reason": "Supabase DB 외부 I/O 대체"
        },
        {
          "target": "PaymentGateway",
          "reason": "외부 결제 API 대체"
        },
        {
          "target": "OrderRepository",
          "reason": "Supabase DB 외부 I/O 대체"
        }
      ]
    }
  ],
  "gherkin_scenarios": [
    {
      "id": "GH-A3-PERCENTAGE",
      "title": "정률 쿠폰 할인",
      "requirement_ids": [
        "REQ-A3-DISCOUNT"
      ],
      "given": [
        "상품 금액은 10000원이다",
        "쿠폰은 20% 정률 할인이고 최대 할인 한도는 없다"
      ],
      "when": [
        "쿠폰 할인 금액을 계산한다"
      ],
      "then": [
        {
          "observable": "할인 금액",
          "expected": 2000
        },
        {
          "observable": "최종 결제 금액",
          "expected": 8000
        }
      ]
    },
    {
      "id": "GH-A3-FIXED-CAP",
      "title": "상품가보다 큰 정액 할인",
      "requirement_ids": [
        "REQ-A3-DISCOUNT"
      ],
      "given": [
        "상품 금액은 10000원이다",
        "쿠폰은 15000원 정액 할인이다"
      ],
      "when": [
        "쿠폰 할인 금액을 계산한다"
      ],
      "then": [
        {
          "observable": "할인 금액",
          "expected": 10000
        },
        {
          "observable": "최종 결제 금액",
          "expected": 0
        }
      ]
    },
    {
      "id": "GH-A3-ZERO-MAX",
      "title": "0원 최대 할인 한도",
      "requirement_ids": [
        "REQ-A3-CAP"
      ],
      "given": [
        "소계는 10000원이다",
        "쿠폰은 50% 정률 할인이고 maximum_discount는 0원이다"
      ],
      "when": [
        "쿠폰 할인 금액을 계산한다"
      ],
      "then": [
        {
          "observable": "할인 금액",
          "expected": 0
        }
      ]
    },
    {
      "id": "GH-A3-EMPTY",